{
  "$schema": "./schemas/research-catalogue.schema.json",
  "catalogue_version": "0.1.0",
  "project": {
    "id": "project:phd-research",
    "title": "PhD Research Papers and Reproducibility Artifacts"
  },
  "papers": [
    {
      "id": "paper:profinfer",
      "path": "papers/profinfer/metadata/paper.json"
    }
  ],
  "artifacts": [
    {
      "id": "artifact:profinfer",
      "path": "papers/profinfer/metadata/artifact.json"
    }
  ]
}

